{
  "name": "sberbank",
  "prefixes": [
    427683,
    427685,
    639002,
    67758,
    427901,
    54693,
    54690,
    427644,
    427601,
    427631,
    42765,
    427466,
    427467,
    427468,
    427469,
    427470,
    427472,
    427475,
    427477,
    427638,
    427655,
    427688,
    546916

  ],
  "country": "ru",
  "localTitle": "Сбербанк",
  "engTitle": "Sberbank",
  "url": "https://www.sberbank.ru",
  "color": "#309c0b"
}
